{
  "schema_version": "1.0.0",
  "event_id": "far-review-schema-fixture-approve-001",
  "recorded_at": "2026-08-13T18:10:00Z",
  "action": "approve",
  "actor": {
    "actor_type": "human",
    "actor_id": "fixture-reviewer",
    "display_name": "Synthetic fixture reviewer"
  },
  "subject": {
    "question_id": "far-q-000001",
    "version_id": "far-q-000001.v001",
    "content_sha256": "76b28b75f1097ad3971259e9383b4415f4903a0de0ac561feba1794d9dd3c598"
  },
  "comment": "Schema fixture only. This event is not James's verdict and grants no learner-ready status."
}
